{
  "$id": "urn:ratatoskr:contracts:commands:v1:PlatformScheduleRegistrationRequested",
  "$schema": "https://json-schema.org/draft/2020-12/schema",
  "title": "PlatformScheduleRegistrationRequested",
  "description": "Payload of `platform.schedule.registration_requested.v1`: a domain service asks Platform to\ncreate or update one recurring schedule.\n\nPlatform upserts on `(service_name, name)`, so registering the same pair again replaces the\nearlier registration. The enclosing command envelope's `producer` MUST equal `service_name`,\nand Platform refuses a registration from a producer it has not allowlisted. When the schedule\nis due Platform publishes `command_type` with `payload` as its template.",
  "type": "object",
  "properties": {
    "command_type": {
      "description": "The command Platform publishes each time the schedule is due.",
      "$ref": "#/$defs/CommandType"
    },
    "cron_expression": {
      "description": "When the schedule fires, as a five-field UTC cron expression.",
      "$ref": "#/$defs/ScheduleCronExpression"
    },
    "enabled": {
      "description": "Whether the schedule fires. A disabled registration keeps the schedule without running it.",
      "type": "boolean"
    },
    "name": {
      "description": "The schedule's name, unique per service.",
      "$ref": "#/$defs/ScheduleRegistrationLabel"
    },
    "operation_kind": {
      "description": "The kind of Platform operation minted for each occurrence.",
      "$ref": "#/$defs/OperationKind"
    },
    "owner_user_id": {
      "description": "The Platform user the scheduled operations belong to.",
      "$ref": "#/$defs/UserId"
    },
    "payload": {
      "description": "Template of the published command's payload. A JSON object, empty when the command needs\nno template.",
      "type": "object",
      "additionalProperties": true
    },
    "service_name": {
      "description": "The registering service, such as `ratatoskr-channel-digests`. Equals the envelope\n`producer`.",
      "$ref": "#/$defs/ScheduleRegistrationLabel"
    }
  },
  "additionalProperties": true,
  "required": [
    "command_type",
    "cron_expression",
    "enabled",
    "name",
    "operation_kind",
    "owner_user_id",
    "payload",
    "service_name"
  ],
  "x-ratatoskr-provenance": {
    "canonical_source": "ratatoskr_operation_contracts::PlatformScheduleRegistrationRequested",
    "contract_id": "platform.schedule_registration_requested",
    "contract_major_version": 1,
    "generated": "DO NOT EDIT — generated by contractsc from the canonical Rust source. Change the Rust type and run `cargo contracts generate`.",
    "generator": "contractsc",
    "generator_version": "0.1.0",
    "schemars_version": "1.2.2",
    "source_digest": "sha256:1052178a2bc2e952796ea94315d88f9976d0357630aca7c62afc55a11cbf94a6",
    "validation_note": "This schema is a LOWER BOUND on validity. Cross-field invariants and canonical-form rules are enforced by the canonical Rust type; see fixtures/invalid-expectations.toml for which layer rejects what."
  },
  "x-ratatoskr-unknown-policy": "preserve",
  "$defs": {
    "CommandType": {
      "title": "CommandType",
      "description": "A command name, `<bounded_context>.<aggregate>.<action>.v<major>`. The `.v<major>` suffix versions the payload contract, not the envelope. Segments are snake_case.",
      "type": "string",
      "examples": [
        "social.capture.requested.v1"
      ],
      "maxLength": 128,
      "pattern": "^[a-z][a-z0-9_]{0,31}\\.[a-z][a-z0-9_]{0,31}\\.[a-z][a-z0-9_]{0,31}\\.v[1-9][0-9]{0,3}$"
    },
    "OperationKind": {
      "title": "OperationKind",
      "description": "What work the operation performs, e.g. `content.document.extract`.\nPresent tense: a kind names an activity, not a completed fact — unlike an event action.\nOpen by construction (a validated string), so there is no unknown-variant problem.",
      "type": "string",
      "examples": [
        "content.document.extract",
        "social.source.sync"
      ],
      "maxLength": 128,
      "pattern": "^[a-z][a-z0-9_]{0,31}(\\.[a-z][a-z0-9_]{0,31}){1,3}$"
    },
    "ScheduleCronExpression": {
      "title": "ScheduleCronExpression",
      "description": "A five-field UTC cron expression, such as `0 6 * * *`.\n\nThis type fixes the shape only: five fields separated by spaces or tabs. Whether every field is\na legal cron term, and when the schedule next fires, is decided by Platform's scheduler,\nwhich refuses an expression it cannot evaluate.",
      "type": "string",
      "examples": [
        "0 6 * * *",
        "*/15 * * * *"
      ],
      "maxLength": 128,
      "pattern": "^[^\\x00-\\x20\\x7f]+([ \\t]+[^\\x00-\\x20\\x7f]+){4}$"
    },
    "ScheduleRegistrationLabel": {
      "title": "ScheduleRegistrationLabel",
      "description": "A stable lowercase label naming a registering service or one of its schedules, such as\n`ratatoskr-channel-digests` or `daily-digest`.\n\nA product identifier, not display text: spaces, uppercase letters and punctuation other\nthan `_` and `-` are refused so one logical schedule cannot exist under several spellings.",
      "type": "string",
      "examples": [
        "ratatoskr-channel-digests",
        "daily-digest"
      ],
      "maxLength": 64,
      "pattern": "^[a-z][a-z0-9_-]{0,63}$"
    },
    "UserId": {
      "title": "UserId",
      "description": "Identity of a Ratatoskr end user. Bare canonical lowercase hyphenated UUID; not namespaced.",
      "type": "string",
      "format": "uuid",
      "examples": [
        "018f0000-0000-7000-8000-000000000001"
      ],
      "pattern": "^[0-9a-f]{8}-[0-9a-f]{4}-[0-9a-f]{4}-[0-9a-f]{4}-[0-9a-f]{12}$"
    }
  }
}
